{
  "manifestVersion": 1,
  "workPackageId": "WP-032",
  "baseCommit": "060c1c4b01458a80835094d5bd004be8c36eec54",
  "scope": "production",
  "allowedPathPatterns": [
    "WORK_PACKAGES/WP-032_Gemeinsamer-Integrationspruefstand.md",
    "tools/architecture-validation/scopes/WP-032.production.scope.json",
    "tools/wp032-integration/verify.py",
    "PROJECT_CONTROL/Integration/WP-032_*.md",
    "PROJECT_CONTROL/Integration/WP-032_*.json",
    "PROJECT_CONTROL/Integration/WP-032_*.txt",
    "PROJECT_CONTROL/Integration/WP-031_*.md",
    "PROJECT_CONTROL/Integration/WP-031_*.json",
    "PROJECT_CONTROL/Integration/WP-031_*.txt",
    "PROJECT_CONTROL/Integration/WP-031_*.patch",
    "tools/wp031-integration/prepare.py",
    "PROJECT_CONTROL/CURRENT_STATE.md",
    "PROJECT_CONTROL/WORK_QUEUE.md",
    "WORK_PACKAGES/WP-029_Abnahme-Nachfuehrung-WP026.md",
    "WORK_PACKAGES/WP-030_HardBudget-Timeout-Untersuchung.md",
    "WORK_PACKAGES/WP-031_Integrationsvorbereitung-WP026-main.md",
    ".github/workflows/validate.yml",
    "Content/Reviews/season-1/F01_BINDINGS.json",
    "Content/Reviews/season-1/HANDOVER.md",
    "Content/Reviews/season-1/REPAIR_HANDOVER.md",
    "Content/Reviews/season-1/REVIEW_RESOLUTION.md",
    "Content/Reviews/season-1/ACCEPTANCE_FOLLOWUP.md"
  ]
}
