{
  "manifestVersion": 1,
  "workPackageId": "WP-006",
  "baseCommit": "79f64d7191672175ede1153c9458be2207ce3c62",
  "scope": "documentation",
  "allowedPathPatterns": [
    "ARCHITECTURE/ARCHITECTURE.md",
    "DECISIONS/README.md",
    "PROJECT_CONTROL/CURRENT_STATE.md",
    "PROJECT_CONTROL/WORK_QUEUE.md",
    "WORK_PACKAGES/WP-006_Architecture-v1.0-Promotion.md",
    "tools/architecture-validation/README.md",
    "tools/architecture-validation/scopes/WP-006.documentation.scope.json",
    "tools/architecture-validation/validate.py"
  ]
}
