{
  "manifestVersion": 1,
  "workPackageId": "WP-025",
  "baseCommit": "5f5127362b101dd4e066b68b21d3e35a5af314df",
  "scope": "production",
  "allowedPathPatterns": [
    "WORK_PACKAGES/WP-025_Proof-v1-Regeneration-und-Strict-Validation.md",
    "tools/architecture-validation/scopes/WP-025.production.scope.json",
    "PROJECT_CONTROL/CURRENT_STATE.md",
    "PROJECT_CONTROL/WORK_QUEUE.md",
    ".github/workflows/validate.yml",
    "ARCHITECTURE/schemas/proof-v1.schema.json",
    "ARCHITECTURE/examples/proof-v1*.json",
    "ARCHITECTURE/LEVEL_DATA_FORMAT.md",
    "ARCHITECTURE/CONTENT_PIPELINE.md",
    "ARCHITECTURE/SOLVER_ARCHITECTURE.md",
    "ARCHITECTURE/TEST_STRATEGY.md",
    "Assets/StammstreckenPuzzle/Scripts/Infrastructure/Content/*.cs",
    "Assets/StammstreckenPuzzle/Scripts/Infrastructure/Content/*.cs.meta",
    "Assets/StammstreckenPuzzle/Scripts/Editor/Content/*.cs",
    "Assets/StammstreckenPuzzle/Scripts/Editor/Content/*.cs.meta",
    "Assets/StammstreckenPuzzle/Tests/EditMode/Content/*.cs",
    "Assets/StammstreckenPuzzle/Tests/EditMode/Content/*.cs.meta",
    "Assets/StammstreckenPuzzle/Tests/EditMode/Content/*.json",
    "Assets/StammstreckenPuzzle/Tests/EditMode/Content/*.json.meta",
    "Assets/StammstreckenPuzzle/Tests/EditMode/Solver/*.cs",
    "Assets/StammstreckenPuzzle/Tests/EditMode/Solver/*.cs.meta",
    "Assets/StammstreckenPuzzle/Tests/EditMode/Solver/*.json",
    "Assets/StammstreckenPuzzle/Tests/EditMode/Solver/*.json.meta"
  ]
}
