{
  "manifestVersion": 1,
  "workPackageId": "WP-030",
  "baseCommit": "f8e1dfc8dc1fdc7846d26060e0b354b6e4a32af8",
  "scope": "production",
  "allowedPathPatterns": [
    "WORK_PACKAGES/WP-030_HardBudget-Timeout-Untersuchung.md",
    "tools/architecture-validation/scopes/WP-030.production.scope.json",
    "tools/wp030-investigation/run_probe.py",
    "PROJECT_CONTROL/Investigations/WP-030_TIMEOUT.md",
    "PROJECT_CONTROL/Investigations/WP-030_EVIDENCE.json",
    "PROJECT_CONTROL/Investigations/WP-030_PROBE.txt",
    "PROJECT_CONTROL/CURRENT_STATE.md",
    "PROJECT_CONTROL/WORK_QUEUE.md",
    ".github/workflows/validate.yml"
  ]
}
