{
  "manifestVersion": 1,
  "workPackageId": "WP-040",
  "baseCommit": "3d1ac59c3f70d50e05434a54d3ddec5d282bb0c3",
  "scope": "production",
  "allowedPathPatterns": [
    "WORK_PACKAGES/WP-040_Public240-Save-Technikbasis.md",
    "tools/architecture-validation/scopes/WP-040.production.scope.json",
    "DECISIONS/ADR-033-interne-transiente-spielschleife.md",
    "DECISIONS/ADR-034-isolierter-public240-reviewpfad.md",
    "DECISIONS/ADR-035-lokaler-save-und-checkpoint-vertrag.md",
    "DECISIONS/README.md",
    "tools/architecture-validation/validate.py",
    ".github/workflows/validate.yml",
    "ARCHITECTURE/CONTENT_PIPELINE.md",
    "ARCHITECTURE/CONTENT_CATALOGS.md",
    "ARCHITECTURE/PERSISTENCE.md",
    "ARCHITECTURE/GAME_STATE_MODEL.md",
    "ARCHITECTURE/MODULE_BOUNDARIES.md",
    "PROJECT_CONTROL/CURRENT_STATE.md",
    "PROJECT_CONTROL/WORK_QUEUE.md",
    "PROJECT_CONTROL/ProductionBlocks/Public240Save/*.md",
    "PROJECT_CONTROL/ProductionBlocks/Public240Save/*.json",
    "PROJECT_CONTROL/ProductionBlocks/Public240Save/*.txt",
    "Assets/StammstreckenPuzzle/Scripts/Application/LocalGameContracts.cs",
    "Assets/StammstreckenPuzzle/Scripts/Application/LocalGameContracts.cs.meta",
    "Assets/StammstreckenPuzzle/Scripts/Infrastructure/Content/CanonicalJsonAdapter.cs",
    "Assets/StammstreckenPuzzle/Scripts/Infrastructure/Content/CanonicalJsonAdapter.cs.meta",
    "Assets/StammstreckenPuzzle/Tests/EditMode/Content/CanonicalJsonAdapterTests.cs",
    "Assets/StammstreckenPuzzle/Tests/EditMode/Content/CanonicalJsonAdapterTests.cs.meta"
  ]
}
